{
  "$schema": "../../schemas/v1/proportion.schema.json",
  "key": "slimevr:shoulders_width",
  "nameKey": "slimevr:proportion.shoulders_width",
  "descriptionKey": "slimevr:proportion.shoulders_width.description",
  "default": {
    "type": "fixed",
    "value": 0.35
  },
  "contributesToHeight": false,
  "minimum": 0
}
