{
  "$schema": "../../schemas/v1/proportion.schema.json",
  "key": "slimevr:lower_chest",
  "nameKey": "slimevr:proportion.lower_chest",
  "descriptionKey": "slimevr:proportion.lower_chest.description",
  "default": {
    "type": "heightRatio",
    "value": 0.10126582
  },
  "contributesToHeight": true,
  "minimum": 0
}
