{
  "$schema": "../../schemas/v1/proportion.schema.json",
  "key": "slimevr:lower_waist",
  "nameKey": "slimevr:proportion.lower_waist",
  "descriptionKey": "slimevr:proportion.lower_waist.description",
  "default": {"type": "heightRatio", "value": 0.06329114},
  "contributesToHeight": true,
  "minimum": 0
}
